candidate_id,listing_name,kind,attribute_key,asserted_value,import_state,source_url,note
beyond-support-network-employment-services-tri-main,Beyond Support Network — Employment Services (Tri-Main Center),provider,entrance_step_free,True,self_reported,https://www.211wny.org/provider/11648/,211WNY directory field 'Handicap Accessible? Yes' with no further detail — mapped to a single conservative entrance claim only (general_accessible_flag_only). Needs first-person confirmation.
opwdd-wny-ddro-region-1,"OPWDD Western New York Developmental Disabilities Regional Office (Region 1, West Seneca)",provider,entrance_step_free,True,self_reported,https://www.211wny.org/provider/8613/,211WNY directory field 'Handicap Accessible? Yes' with no further detail — mapped to a single conservative entrance claim only (general_accessible_flag_only). Needs first-person confirmation.
buffalo-therapy-services-kaleida-mfsh,Buffalo Therapy Services - Millard Fillmore Suburban Hospital (Kaleida Health),provider,entrance_step_free,True,self_reported,https://www.211wny.org/provider/5177/,Handicap Accessible? Yes
ecmc-center-for-rehabilitation-services-outpatient,ECMC Center for Rehabilitation Services - Outpatient Therapy,provider,entrance_step_free,True,self_reported,https://www.211wny.org/provider/7410/,Handicap Accessible? Yes
buffalo-arts-studio,Buffalo Arts Studio,place,accessible_restroom,True,self_reported,https://buffaloartsstudio.org/accessibility/,All public restrooms are handicap accessible.
buffalo-arts-studio,Buffalo Arts Studio,place,accessible_parking,True,self_reported,https://buffaloartsstudio.org/accessibility/,Mobility accessible parking spots are available in the Visitor and Access parking lots on Halbert between Phelps and Jewett Ave.
